{"contract_version":"0.1.0","entries":[{"artifact_path":"logs/counters.json","contract_id":"counters","pass_id":"orchestrator.operability.counters.emit","stage_owner":"orchestrator","validation_mode":"json_document"},{"artifact_path":"manifest.json","contract_id":"manifest","pass_id":"orchestrator.manifest.emit","stage_owner":"orchestrator","validation_mode":"json_document"},{"artifact_path":"runner/actions/action-1/executor.json","contract_id":"runner_executor_evidence","pass_id":"runner.action.executor_evidence.emit","stage_owner":"runner","validation_mode":"json_document"},{"artifact_path":"scoring/summary.json","contract_id":"summary","pass_id":"scoring.summary.emit","stage_owner":"scoring","validation_mode":"json_document"}],"run_id":"00000000-0000-4000-8000-000000000000","schema_version":"pa:pass_manifest:v1"}